{
  "$schema": "https://json-schema.org/draft/2020-12/schema",
  "$id": "https://microhack.local/contracts/telemetry-evidence-capture.schema.json",
  "title": "Telemetry evidence capture manifest",
  "description": "Input to `python -m catalog_acceptance.telemetry_evidence_cli`. One document recording what was observed in Azure Monitor, from which the renderer produces the telemetry report and its four result files. Signal names, metric units and the report structure come from behavior-contract.json and must not be written here.",
  "type": "object",
  "additionalProperties": false,
  "required": [
    "schemaVersion",
    "workspaceId",
    "capturedAt",
    "service",
    "resourceAttributes",
    "queries"
  ],
  "properties": {
    "schemaVersion": {
      "const": "1.0.0"
    },
    "workspaceId": {
      "type": "string",
      "minLength": 1,
      "description": "The Log Analytics workspace the queries were run against. Resolve it by name: two workspaces exist in this environment."
    },
    "capturedAt": {
      "type": "string",
      "format": "date-time",
      "description": "When the observations were taken, not when the manifest was written."
    },
    "service": {
      "type": "string",
      "minLength": 1
    },
    "resourceAttributes": {
      "type": "object",
      "minProperties": 1,
      "additionalProperties": {
        "type": "string"
      },
      "description": "Must cover every name in behavior-contract.json telemetry.requiredResourceAttributes."
    },
    "queries": {
      "type": "object",
      "additionalProperties": false,
      "required": [
        "resources",
        "traces",
        "metrics",
        "logs"
      ],
      "properties": {
        "resources": {
          "$ref": "#/$defs/query"
        },
        "traces": {
          "$ref": "#/$defs/query"
        },
        "metrics": {
          "$ref": "#/$defs/query"
        },
        "logs": {
          "$ref": "#/$defs/query"
        }
      }
    }
  },
  "$defs": {
    "query": {
      "type": "object",
      "additionalProperties": false,
      "required": [
        "query",
        "revision",
        "signals"
      ],
      "properties": {
        "query": {
          "type": "string",
          "minLength": 10,
          "description": "The KQL actually executed. Recorded so the evidence names its own source."
        },
        "signals": {
          "type": "object",
          "minProperties": 1,
          "additionalProperties": {
            "$ref": "#/$defs/signal"
          },
          "description": "Keyed by signal name. The set must match the contract exactly: no extras, no omissions. A signal you did not observe is a signal to go and measure, not one to invent."
        },
        "revision": {
          "type": "string",
          "minLength": 1,
          "description": "Container App revision these rows came from (the AppRoleInstance value). All four queries must name the same revision: telemetry captured from a revision other than the one under test does not describe the release."
        }
      }
    },
    "signal": {
      "type": "object",
      "additionalProperties": false,
      "required": [
        "recordCount",
        "observedAttributes"
      ],
      "properties": {
        "recordCount": {
          "type": "integer",
          "minimum": 0,
          "description": "Zero is structurally valid so the renderer, not the schema, reports it -- the renderer names the signal and points at docs/TelemetryFaultInjection.md, which a schema violation cannot do."
        },
        "observedAttributes": {
          "type": "array",
          "minItems": 1,
          "items": {
            "type": "string"
          },
          "description": "Must be a superset of the contract's frozen attribute list for this signal."
        },
        "observations": {
          "type": "array",
          "minItems": 1,
          "items": {
            "type": "object"
          },
          "description": "Required for every traces and logs signal. The renderer will not default an empty list: an empty observations array is refused at render time rather than at the handoff gate."
        },
        "measurements": {
          "type": "array",
          "minItems": 1,
          "items": {
            "type": "object"
          },
          "description": "Required for every metrics signal. catalog.import.records needs at least one measurement whose catalog.import.outcome is \"rejected\" with a positive, finite, integral value; see docs/TelemetryFaultInjection.md."
        }
      }
    }
  }
}
