{
  "schemaVersion": "1.0.0",
  "workspaceId": "/subscriptions/7bc68c68-3c40-4cea-bf3b-2b0d1a83b1c0/resourceGroups/rg-user001/providers/Microsoft.OperationalInsights/workspaces/log-mh-user001-dotnet",
  "capturedAt": "2026-08-27T23:35:00Z",
  "service": "mh-catalog-dotnet",
  "resourceAttributes": {
    "service.name": "mh-catalog-dotnet",
    "service.namespace": "app-innovation",
    "service.version": "47acf263d3320fa3bb41d5469fc3c7428a393fca",
    "deployment.environment": "lab",
    "service.instance.id": "ca-mh-user001-dotnet--release-47acf263d332-5896fb77ff-9rqhl",
    "azure.containerapps.revision.name": "ca-mh-user001-dotnet--release-47acf263d332"
  },
  "queries": {
    "resources": {
      "query": "AppMetrics | where Name=='_APPRESOURCEPREVIEW_' | where TimeGenerated>ago(3h) | extend r=tostring(Properties['azure.containerapps.revision.name']) | where r=='ca-mh-user001-dotnet--release-47acf263d332' | project Properties",
      "revision": "ca-mh-user001-dotnet--release-47acf263d332",
      "signals": {
        "resource": {
          "recordCount": 3,
          "observedAttributes": [
            "azure.containerapps.revision.name",
            "deployment.environment",
            "service.instance.id",
            "service.name",
            "service.namespace",
            "service.version"
          ]
        }
      }
    },
    "traces": {
      "query": "union (AppRequests|extend sig='http.server'), (AppDependencies|extend sig=iff(DependencyType=='SQL','db.client',Name)), (AppExceptions|extend sig='exception') | where AppRoleInstance startswith 'ca-mh-user001-dotnet--release-47acf263d332' | where TimeGenerated>ago(3h) | summarize count() by sig",
      "revision": "ca-mh-user001-dotnet--release-47acf263d332",
      "signals": {
        "http.server": {
          "recordCount": 2278,
          "observedAttributes": [
            "http.request.method",
            "http.response.status_code",
            "http.route",
            "server.address"
          ],
          "observations": [
            {
              "attributes": {
                "http.request.method": "GET",
                "http.route": "/figure/{id}",
                "http.response.status_code": 200,
                "server.address": "localhost"
              }
            },
            {
              "attributes": {
                "http.request.method": "GET",
                "http.route": "/readyz",
                "http.response.status_code": 200,
                "server.address": "localhost"
              }
            }
          ]
        },
        "db.client": {
          "recordCount": 523,
          "observedAttributes": [
            "db.namespace",
            "db.operation.name",
            "db.system.name",
            "server.address"
          ],
          "observations": [
            {
              "attributes": {
                "db.system.name": "microsoft.sql_server",
                "db.operation.name": "SELECT",
                "db.namespace": "catalog",
                "server.address": "sql-mh-user001-dotnet-kurep3z6.database.windows.net"
              }
            }
          ]
        },
        "exception": {
          "recordCount": 12,
          "observedAttributes": [
            "exception.message",
            "exception.type"
          ],
          "observations": [
            {
              "attributes": {
                "exception.type": "LegoCatalog.App.Services.CatalogImportValidationException",
                "exception.message": "Record 2 is invalid: category must normalize to a non-empty slug."
              }
            },
            {
              "attributes": {
                "exception.type": "Microsoft.Data.SqlClient.SqlException",
                "exception.message": "The SELECT permission was denied on the object 'Figures', database 'catalog', schema 'dbo'."
              }
            }
          ]
        },
        "catalog.import": {
          "recordCount": 7,
          "observedAttributes": [
            "catalog.import.inserted",
            "catalog.import.rejected",
            "catalog.import.skipped"
          ],
          "observations": [
            {
              "attributes": {
                "catalog.import.inserted": 0,
                "catalog.import.skipped": 1,
                "catalog.import.rejected": 0
              }
            },
            {
              "attributes": {
                "catalog.import.inserted": 1,
                "catalog.import.skipped": 0,
                "catalog.import.rejected": 0
              }
            }
          ]
        },
        "catalog.query": {
          "recordCount": 1678,
          "observedAttributes": [
            "catalog.query.filter",
            "catalog.query.result_count"
          ],
          "observations": [
            {
              "attributes": {
                "catalog.query.filter": "all",
                "catalog.query.result_count": 198
              }
            }
          ]
        },
        "catalog.performance": {
          "recordCount": 1637,
          "observedAttributes": [
            "catalog.performance.item_count",
            "catalog.performance.work_factor"
          ],
          "observations": [
            {
              "attributes": {
                "catalog.performance.work_factor": 10,
                "catalog.performance.item_count": 198
              }
            }
          ]
        }
      }
    },
    "metrics": {
      "query": "AppMetrics | where AppRoleInstance startswith 'ca-mh-user001-dotnet--release-47acf263d332' | where TimeGenerated>ago(3h) | where Name in ('http.server.request.duration','db.client.operation.duration','catalog.import.records','catalog.query.duration','catalog.performance.duration') | project Name,Sum,ItemCount,Properties",
      "revision": "ca-mh-user001-dotnet--release-47acf263d332",
      "signals": {
        "http.server.request.duration": {
          "recordCount": 13,
          "observedAttributes": [
            "http.request.method",
            "http.response.status_code",
            "http.route"
          ],
          "measurements": [
            {
              "attributes": {
                "http.request.method": "GET",
                "http.route": "/figure/{id}",
                "http.response.status_code": 200
              },
              "value": 0.0134547
            },
            {
              "attributes": {
                "http.request.method": "GET",
                "http.route": "/readyz",
                "http.response.status_code": 200
              },
              "value": 0.0693425
            }
          ]
        },
        "db.client.operation.duration": {
          "recordCount": 523,
          "observedAttributes": [
            "db.operation.name",
            "db.system.name"
          ],
          "measurements": [
            {
              "attributes": {
                "db.system.name": "microsoft.sql_server",
                "db.operation.name": "connect"
              },
              "value": 0.0657491
            }
          ]
        },
        "catalog.import.records": {
          "recordCount": 7,
          "observedAttributes": [
            "catalog.import.outcome"
          ],
          "measurements": [
            {
              "attributes": {
                "catalog.import.outcome": "rejected"
              },
              "value": 1
            },
            {
              "attributes": {
                "catalog.import.outcome": "inserted"
              },
              "value": 1
            },
            {
              "attributes": {
                "catalog.import.outcome": "skipped"
              },
              "value": 1
            }
          ]
        },
        "catalog.query.duration": {
          "recordCount": 49,
          "observedAttributes": [
            "catalog.query.filter"
          ],
          "measurements": [
            {
              "attributes": {
                "catalog.query.filter": "category+search"
              },
              "value": 0.0134695
            }
          ]
        },
        "catalog.performance.duration": {
          "recordCount": 16,
          "observedAttributes": [
            "catalog.performance.work_factor"
          ],
          "measurements": [
            {
              "attributes": {
                "catalog.performance.work_factor": 10
              },
              "value": 0.5467932
            }
          ]
        }
      }
    },
    "logs": {
      "query": "union (AppTraces|extend sig=tostring(Properties['OriginalFormat'])|extend sig=iff(isempty(sig),Message,sig)), (AppExceptions|extend sig=tostring(Properties['OriginalFormat'])) | where AppRoleInstance startswith 'ca-mh-user001-dotnet--release-47acf263d332' | where TimeGenerated>ago(3h) | summarize count() by sig",
      "revision": "ca-mh-user001-dotnet--release-47acf263d332",
      "signals": {
        "http.server.request": {
          "recordCount": 3002,
          "observedAttributes": [
            "http.request.method",
            "http.response.status_code",
            "http.route"
          ],
          "observations": [
            {
              "attributes": {
                "http.request.method": "GET",
                "http.route": "/figure/{id}",
                "http.response.status_code": 200
              }
            },
            {
              "attributes": {
                "http.request.method": "GET",
                "http.route": "/readyz",
                "http.response.status_code": 200
              }
            }
          ]
        },
        "catalog.database.failed": {
          "recordCount": 8,
          "observedAttributes": [
            "db.operation.name",
            "db.system.name",
            "exception.type"
          ],
          "observations": [
            {
              "attributes": {
                "db.system.name": "microsoft.sql_server",